Title,Description,Tags,Due Date,Estimated Time,Priority
"Complete project report","Write the final report for the project.","work,urgent","2023-12-25",3,"High"
"Buy groceries","Purchase groceries for the week.","shopping","2023-12-15",1,"Low"
"Prepare for meeting","Prepare slides and notes for the meeting.","work,urgent","2023-12-20",2,"Medium"
"Read book for course","Complete reading chapters 3 and 4 for the course.","study","2023-12-18",2,"Medium"
"Submit assignment","Submit the assignment before the deadline.","work","2023-12-22",1,"High"
"Finish website design","Complete the homepage and layout for the website.","design, urgent","2023-12-30",3,"High"
"Organize team meeting","Schedule and prepare for the weekly team meeting.","work, team","2023-12-23",2,"Medium"
"Research for presentation","Research and prepare content for the business proposal.","research","2023-12-18",1,"Low"
"Fix bugs in the app","Work on fixing critical bugs reported by QA team.","development","2023-12-27",3,"High"
"Clean the house","Complete the cleaning of the entire house.","household","2023-12-16",1,"Low"
"Draft the email template","Write an email template for the upcoming marketing campaign.","marketing","2023-12-19",2,"Medium"
"Prepare the budget report","Create a budget report for the upcoming fiscal year.","work","2023-12-10",3,"High"
"Plan team-building event","Organize a team-building activity for employees.","work, team","2023-12-24",2,"Medium"
"Write blog post","Write a blog post about the latest trends in technology.","content, tech","2023-12-21",1,"Low"
"Create marketing strategy","Develop a strategy for the next quarter's marketing campaign.","marketing","2023-12-29",3,"High"
"Design new logo","Design a new logo for the company's rebranding.","design","2023-12-25",2,"Medium"
"Compile product catalog","Compile the latest product catalog for the sales team.","work","2023-12-28",1,"Low"
"Test new software release","Conduct testing for the new software release.","development","2023-12-20",2,"Medium"
"Research competitors","Analyze competitor products and marketing strategies.","research","2023-12-19",3,"High"
"Attend conference","Attend the annual business conference and take notes.","work","2023-12-17",1,"Low"
"Write user manual","Write a user manual for the new product launch.","documentation","2023-12-22",2,"Medium"
"Review project proposal","Review the latest project proposal from the client.","work","2023-12-14",3,"High"
"Order office supplies","Order new office supplies for the department.","work","2023-12-16",1,"Low"
"Complete training course","Finish the online course on Python programming.","training","2023-12-23",2,"Medium"
"Conduct employee survey","Conduct an employee satisfaction survey for feedback.","work, survey","2023-12-18",3,"High"
"Revise project plan","Revise the project plan based on feedback from the team.","work","2023-12-26",2,"Medium"
"Prepare proposal","Prepare a business proposal for a potential client.","work","2023-12-21",3,"High"
"Write press release","Write a press release for the product launch event.","content","2023-12-20",1,"Low"
"Submit expense report","Submit the monthly expense report to finance.","work","2023-12-29",2,"Medium"
"Develop mobile app","Create a mobile app for the company’s new feature.","development","2023-12-22",3,"High"
"Conduct market research","Conduct research on the latest market trends in our industry.","research","2023-12-19",1,"Low"
"Schedule interviews","Schedule interviews with candidates for the open positions.","work","2023-12-15",2,"Medium"
"Attend training session","Attend an in-house training session on leadership skills.","training","2023-12-20",1,"Low"
"Update website content","Update the content on the company’s website.","content","2023-12-17",2,"Medium"
"Create project timeline","Create a detailed project timeline for the new product.","work","2023-12-30",3,"High"
"Organize product launch","Organize the event for the new product launch.","work, event","2023-12-25",3,"High"
"Write product description","Write descriptions for new products for the website.","content, marketing","2023-12-22",2,"Medium"
"Analyze sales data","Analyze the sales data for last quarter and prepare a report.","work, sales","2023-12-19",2,"Medium"
"Update company policies","Update the company’s HR policies and procedures.","work, HR","2023-12-18",3,"High"
"Coordinate with suppliers","Communicate with suppliers to ensure timely delivery of goods.","work, procurement","2023-12-21",2,"Medium"
"Prepare team presentation","Prepare the presentation for the team’s meeting next week.","work, team","2023-12-24",2,"Medium"
"Check inventory","Check inventory levels and reorder if necessary.","work, inventory","2023-12-16",1,"Low"
"Develop database schema","Design the schema for the new database project.","development","2023-12-30",3,"High"
"Write technical blog","Write a technical blog post about cloud computing.","content, tech","2023-12-25",1,"Low"
"Prepare contract draft","Draft the contract for the new client.","legal","2023-12-28",3,"High"
"Create onboarding documents","Prepare onboarding documents for new employees.","work, HR","2023-12-17",2,"Medium"
"Coordinate with marketing team","Work with the marketing team to finalize the ad campaign.","work, marketing","2023-12-29",1,"Low"
"Write research paper","Write a research paper for the upcoming conference.","research","2023-12-15",2,"Medium"
"Compile product feedback","Gather feedback on the product from customers and compile it.","work, feedback","2023-12-18",3,"High"
"Create training materials","Create training materials for new hires in the company.","work, training","2023-12-21",2,"Medium"
"Host a webinar","Host a webinar for the company’s new product.","event, marketing","2023-12-19",3,"High"
"Analyze customer reviews","Analyze customer feedback on the company’s products.","feedback","2023-12-22",2,"Medium"
"Create project documentation","Prepare detailed project documentation for a new client.","documentation","2023-12-30",3,"High"
"Complete customer survey","Send out a customer satisfaction survey for feedback.","survey","2023-12-25",1,"Low"
"Generate sales report","Generate a detailed sales report for the last quarter.","work, sales","2023-12-24",3,"High"
"Review marketing plan","Review and update the marketing plan for the next quarter.","work, marketing","2023-12-18",2,"Medium"
"Organize charity event","Organize a charity event for the company’s CSR initiative.","work, event","2023-12-17",1,"Low"
"Design banner ad","Design a banner ad for the upcoming campaign.","design, marketing","2023-12-16",2,"Medium"
"Schedule company-wide meeting","Schedule and organize the company-wide meeting for next month.","work, meeting","2023-12-19",3,"High"
"Prepare team performance review","Prepare the performance review for your team.","work, HR","2023-12-23",1,"Low"
"Create website landing page","Create the landing page for the new website launch.","design","2023-12-30",2,"Medium"
"Write client proposal","Write a proposal for a potential client.","work, sales","2023-12-28",2,"Medium"
"Organize team lunch","Organize a team lunch event for employee bonding.","work, team","2023-12-16",1,"Low"
"Develop internal tools","Develop internal tools to improve team collaboration.","development","2023-12-21",3,"High"
"Organize company outing","Organize an outing event for employees.","work, event","2023-12-18",2,"Medium"
"Create social media plan","Create a social media plan for the product launch.","marketing","2023-12-17",3,"High"
"Conduct code review","Review the code for the latest release.","development","2023-12-30",2,"Medium"
"Attend leadership training","Attend the leadership training session organized by HR.","training","2023-12-23",1,"Low"
"Update project plan","Update the project plan based on the latest feedback.","work","2023-12-19",3,"High"
"Write code for feature","Write code for a new feature in the product.","development","2023-12-28",2,"Medium"
"Coordinate with sales team","Coordinate with the sales team for the latest campaign.","work, sales","2023-12-22",3,"High"
"Submit final report","Submit the final report for the project to the manager.","work","2023-12-30",1,"Low"
